,Real Name,Birthplace,Date of Birth,Debut,Date of Death,wrestler_name,Weight and Height,Weight,Height
3319,Winona Barkley,"Reynolds, Georgia (United States of America)",5th September 1955,1st July 1976 (45 years ago),9th May 2020,Winona Little Heart ,,,
3325,unknown,,13th November 1964 (age 57),,,Mike Samples,252 lbs. (114 kg) at 6'2'' (1.88 m),,
3407,Bryan Wenzel,"Butler, New Jersey (United States of America)",29th April 1980 (age 41),26th February 1999 (23 years ago),,Mr. Strongko,262 lbs. (119 kg) at 6'2'' (1.88 m),,
3842,Anthony Felker,"Dallas, Texas (United States of America)",1961,1980,,Tony Falk,240 lbs. (109 kg) at 6'1'' (1.85 m),,
4502,unknown,,,1983,1st January 2019,Jim Evans,,,
4779,unknown,"Vancouver, British Columbia (Canada)",,??th June 2002,,Freddy Funk,340 lbs. (154 kg) at 6'0'' (1.83 m),,
5130,unknown,,,,,Khris Germany,265 lbs. (120 kg) at 6'2'' (1.88 m),,
5569,unknown,,,,,SC Supreme,,,
5902,unknown,,,14th December 1979 (42 years ago),,Gary Royal,,,
6101,Leroy Anthony Howard,"St. Petersburg, Florida (United States of America)",1969,1990,,Leroy Howard,276 lbs. (125 kg) at 5'11'' (1.80 m),,
6679,unknown,California (United States of America),2nd January 1934,,17th June 1971,Alberto Torres,,,
7083,unknown,,,,,Jason Hades,,,
7098,Chris Taylor,,13th June 1950,8th December 1973 (48 years ago),30th June 1979,Chris Taylor,450 lbs. (204 kg) at 6'5'' (1.96 m),,
7722,unknown,"Dublin, Dublin (Ireland)",30th September 1988 (age 33),??th March 2005,,Sean South,210 lbs. (95 kg) at 6'1'' (1.85 m),,
9149,Omar Mazzi,"Vicenza, Veneto (Italy)",,1st April 2007 (14 years ago),,OGM,212 lbs. (96 kg) at 5'11'' (1.80 m),,
9822,Dan Evensen,"Arendal, Aust-Agder (Norway)",1st June 1974 (age 47),11th May 2002 (19 years ago),,Dan Evensen,250 lbs. (113 kg) at 6'3'' (1.91 m),,
9852,Johnny Rivera,Hormigueros (Puerto Rico),1949,1975,,Johnny Rivera,231 lbs. (105 kg) at 5'8'' (1.73 m),,
10262,Ryan James Jensen,"Omaha, Nebraska (United States of America)",20th September 1977 (age 44),22nd February 1997 (25 years ago),,Ryan Jensen,185 lbs. (84 kg) at 6'1'' (1.85 m),,
10920,William Nicholas White,"Philadelphia, Pennsylvania (United States of America)",27th February 1945,1964,7th September 2021,Bill White,250 lbs. (113 kg) at 6'1'' (1.85 m),,
12185,unknown,Kyoto (Japan),20th December 1988 (age 33),10th May 2008 (13 years ago),,Kazuaki Mihara,214 lbs. (97 kg) at 5'7'' (1.70 m),,
14371,Fa'apipi'i Lale Igafo Sa'ole,Samoa,4th February 1943,,29th March 2005,Farmer Boy Ipo,358 lbs. (162 kg) at 6'2'' (1.88 m),,
14407,unknown,"Christiansburg, Virginia (United States of America)",22nd March 1970 (age 51),9th September 1992 (29 years ago),,Frank Parker,265 lbs. (120 kg) at 6'3'' (1.91 m),,
15099,Rumina Sato,"Odawara, Kanagawa (Japan)",27th December 1973 (age 48),7th November 1994 (27 years ago),,Rumina Sato,145 lbs. (66 kg) at 5'6'' (1.68 m),,
15241,unknown,United Kingdom,,,,Brett Eagle,,,
16582,Mario Bokara,"New Milford, New Jersey (United States of America)",2nd December 1980 (age 41),??th August 2000,,Mo Sexton,220 lbs. (100 kg) at 5'11'' (1.80 m),,
16877,unknown,New York (United States of America),,,,Slugga,366 lbs. (166 kg) at 6'8'' (2.03 m),,
18278,Nicholas Brashear,"Cleveland, Ohio (United States of America)",2nd September 1981 (age 40),,,Nick Belushi,325 lbs. (147 kg) at 6'6'' (1.98 m),,
18618,TJ O'Brien,"Sacramento, California (United States of America)",1st January 1987 (age 35),20th April 2007 (14 years ago),,TJ O'Brien,155 lbs. (70 kg) at 6'2'' (1.88 m),,
19746,Jaime Jara,"North Highlands, California (United States of America)",8th February 1969 (age 53),8th September 2002 (19 years ago),,Jaime Jara,170 lbs. (77 kg) at 6'1'' (1.85 m),,
23967,unknown,"Liverpool, Merseyside, England (United Kingdom)",,,,James Grace,182 lbs. (83 kg) at 5'11'' (1.80 m),,
28720,David Luster,,7th December 1981 (age 40),2000,,Luster the Legend,246 lbs. (112 kg) at 6'5'' (1.96 m),,
31656,Mathias Behrens,"Halberstadt, Sachsen-Anhalt (Germany)",16th April ???,,,Matze,192 lbs. (87 kg) at 6'1'' (1.85 m),,
32294,unknown,"Meppen, Niedersachsen (Germany)",26th January 1996 (age 26),23rd June 2017 (4 years ago),,Abdul Kenan,254 lbs. (115 kg) at 5'7'' (1.70 m),,
35436,unknown,"Shimotsuke, Tochigi (Japan)",28th December 2006 (age 15),17th June 2017 (4 years ago),,Rina ,99 lbs. (45 kg) at 5'1'' (1.55 m),,
36651,Dartanyon Ruffin,"Detroit, Michigan (United States of America)",14th April 1996 (age 25),1st January 2017 (5 years ago),,Leon Ruff,150 lbs. (68 kg) at 5'7'' (1.70 m),,
221,Nelson Frazier Jr.,"Memphis, Tennessee (United States of America)",14th February 1971,1991,18th February 2014,Viscera,496 lbs. (225 kg) at 6'6'' (1.98 m),,
4111,Colin Matthew Delaney,"Rochester, New York (United States of America)",7th September 1986 (age 35),2003,,Colin Delaney,172 lbs. (78 kg) at 5'9'' (1.75 m),,
143,Ernest Clifford Miller,"Atlanta, Georgia (United States of America)",14th January 1964 (age 58),1997,,Ernest Miller,235 lbs. (107 kg) at 6'2'' (1.88 m),,
2361,Rafael García Sánchez,"Ciudad de México, Ciudad de México (Mexico)",22nd February 1971 (age 51),5th August 1990 (31 years ago),,Súper Caló,192 lbs. (87 kg) at 5'8'' (1.73 m),,
3665,José Decni Chabelas Amador,"Tetitlán, Guerrero (Mexico)",18th July 1978 (age 43),??th June 1999,,Decnis,179 lbs. (81 kg) at 5'8'' (1.73 m),,
2883,Milena Leticia Roucka,"Vancouver, British Columbia (Canada)",25th October 1979 (age 42),??th October 2006,,Rosa Mendes ,125 lbs. (57 kg) at 5'8'' (1.73 m),,
801,James Kirkharrell,"Roanoke, Virginia (United States of America)",13th December 1959 (age 62),??th May 1978,,Boris Zhukov,260 lbs. (118 kg) at 6'2'' (1.88 m),,
6256,unknown,Mexico,13th August 1986 (age 35),2006,,Argenis,,,
1319,Juan Carlos Baños,"Acapulco de Juárez, Guerrero (Mexico)",16th October 1972 (age 49),1st July 1991 (30 years ago),,Lizmark Jr.,262 lbs. (119 kg) at 6'1'' (1.85 m),,
2430,Juan González,"Heroica Puebla de Zaragoza, Puebla (Mexico)",22nd February 1967 (age 55),,,Psicosis,187 lbs. (85 kg) at 5'9'' (1.75 m),,
713,Luis Rabadan Jr.,"Ciudad de México, Ciudad de México (Mexico)",16th July 1966 (age 55),26th July 1985 (36 years ago),,Blue Demon Jr.,194 lbs. (88 kg) at 5'8'' (1.73 m),,
27729,Brandel Littlejohn,"Trenton, New Jersey (United States of America)",5th May 1987 (age 34),5th April 2012 (9 years ago),,The World Famous CB,136 lbs. (62 kg) at 5'8'' (1.73 m),,
1249,Josette Bynum,"Minneapolis, Minnesota (United States of America)",11th September 1977 (age 44),11th April 2002 (19 years ago),,Josette Bynum ,140 lbs. (64 kg) at 5'4'' (1.63 m),,
594,Cynthia Lynch,"North Arlington, New Jersey (United States of America)",18th May 1971 (age 50),??th December 1996,,Bobcat ,128 lbs. (58 kg) at 5'8'' (1.73 m),,
2188,Harry Del Rios,"New York City, New York (United States of America)",17th September 1961 (age 60),1992,,Phantasio,273 lbs. (124 kg) at 6'4'' (1.93 m),,
1749,Andrés Reyes González,"Santa Anita, Jalisco (Mexico)",18th April 1963,15th June 1985 (36 years ago),1st May 2018,Universo Dos Mil,216 lbs. (98 kg) at 6'0'' (1.83 m),,
947,William Brenneman,"Clearwater, Florida (United States of America)",21st November 1959 (age 62),1989,,Jerry Flynn,270 lbs. (122 kg) at 6'2'' (1.88 m),,
1161,Tom Brandi,"Philadelphia, Pennsylvania (United States of America)",9th July 1966 (age 55),14th September 1985 (36 years ago),,Tom Brandi,231 lbs. (105 kg) at 6'2'' (1.88 m),,
2723,Donald Haviland,"Baltimore, Maryland (United States of America)",7th December 1973,19th October 1990 (31 years ago),5th December 2015,Hack Meyers,225 lbs. (102 kg) at 6'2'' (1.88 m),,
890,Ignacio Gómez Ruíz,"Tulancingo de Bravo, Hidalgo (Mexico)",31st July 1932,1952,29th November 2008,El Nazi,205 lbs. (93 kg) at 5'9'' (1.75 m),,
611,Rhea Alessandra Calaveras,Saint Croix (United States Virgin Islands),23rd October 1972 (age 49),1999,,Jasmin St. Claire ,110 lbs. (50 kg) at 5'7'' (1.70 m),,
9334,unknown,"Middleborough, Massachusetts (United States of America)",,,,Rick Fuller,325 lbs. (147 kg) at 6'3'' (1.91 m),,
12085,Wesley Brisco,"Tampa, Florida (United States of America)",21st February 1983 (age 39),2009,,Wes Brisco,210 lbs. (95 kg) at 5'10'' (1.78 m),,
9836,unknown,"Kingston upon Hull, East Yorkshire, England (United Kingdom)",9th October 1990 (age 31),26th August 2006 (15 years ago),,Nathan Cruz,186 lbs. (84 kg) at 5'10'' (1.78 m),,
1504,Perry Jackson,"Texarkana, Arkansas (United States of America)",,,,Action Jackson,287 lbs. (130 kg) at 6'3'' (1.91 m),,
4165,Patrick Frary,"Norwich, Norfolk, England (United Kingdom)",14th December 1953 (age 68),1985,,Ricky Knight,247 lbs. (112 kg) at 5'9'' (1.75 m),,
7688,Brandon Castillo,Mexico,11th October 1979 (age 42),2004,,Yuriko,,,
431,Orlando Jordan,"Salem, New Jersey (United States of America)",21st April 1974 (age 47),2000,,Orlando Jordan,256 lbs. (116 kg) at 6'4'' (1.93 m),,
695,Jaime Lynne,"Nashville, Tennessee (United States of America)",17th March 1979 (age 42),2002,,Lollipop ,118 lbs. (54 kg) at 5'7'' (1.70 m),,
2159,Joseph Magliano,"Baltimore, Maryland (United States of America)",29th September 1967,1987,15th October 2006,Joey Maggs,235 lbs. (107 kg) at 6'0'' (1.83 m),,
778,Ryuma Izumida,"Kurihara, Miyagi (Japan)",28th October 1965,25th May 1992 (29 years ago),25th January 2017,Junji Izumida,306 lbs. (139 kg) at 6'1'' (1.85 m),,
2281,Timothy R. Calkins Jr.,"New York City, New York (United States of America)",29th December 1975,2001,7th January 2015,Tim Arson,245 lbs. (111 kg) at 6'2'' (1.88 m),,
2746,Ernie Osiris Cirruzzo,"Southampton, New York (United States of America)",,12th May 2006 (15 years ago),,Ernie Osiris,181 lbs. (82 kg) at 5'7'' (1.70 m),,
587,Kevin Francis Sullivan,"Key West, Florida (United States of America)",26th October 1949 (age 72),1970,,Kevin Sullivan,240 lbs. (109 kg) at 5'11'' (1.80 m),,
285,Ronald Jason Knight,"Waterbury, Connecticut (United States of America)",12th December 1963 (age 58),??th June 1984,,Jason Knight,180 lbs. (82 kg) at 5'9'' (1.75 m),,
2436,Christian Städter,"Visselhövede, Niedersachsen (Germany)",18th March 1976 (age 45),1998,,Crazy Johnny Tiger,233 lbs. (106 kg) at 5'10'' (1.78 m),,
14998,unknown,Ciudad de Panamá (Panama),20th February 1975 (age 47),6th October 2009 (12 years ago),,Dalys la Caribeña ,143 lbs. (65 kg) at 5'6'' (1.68 m),,
57,Marcus Alexander Bagwell,"Marietta, Georgia (United States of America)",10th January 1970 (age 52),1990,,Buff Bagwell,240 lbs. (109 kg) at 6'1'' (1.85 m),,
3416,Ron Waterman,"Greeley, Colorado (United States of America)",23rd November 1965 (age 56),6th February 1999 (23 years ago),,Ron Waterman,275 lbs. (125 kg) at 6'2'' (1.88 m),,
4389,Chasyn Rance,"Miami, Florida (United States of America)",15th March 1983 (age 38),25th June 1999 (22 years ago),,Chasyn Rance,187 lbs. (85 kg) at 5'9'' (1.75 m),,
232,Don Harris,"Nashville, Tennessee (United States of America)",23rd October 1961 (age 60),1987,,Don Harris,280 lbs. (127 kg) at 6'5'' (1.96 m),,
209,Joe Applebaumer,"Chicago, Illinois (United States of America)",,29th March 1995 (26 years ago),,Pogo the Clown,440 lbs. (200 kg) at 6'6'' (1.98 m),,
340,Nathan Jones,"Sydney, New South Wales (Australia)",21st August 1970 (age 51),11th October 1997 (24 years ago),,Nathan Jones,340 lbs. (154 kg) at 6'10'' (2.08 m),,
2427,Justin Rocheleau,"Robbinsdale, Minnesota (United States of America)",18th June 1975 (age 46),2nd June 1996 (25 years ago),,Bam Bam Nealy,275 lbs. (125 kg) at 6'7'' (2.01 m),,
1588,Christopher Ashford-Smith,"Tampa, Florida (United States of America)",17th February 1961,1984,22nd August 2018,Chris Champion,222 lbs. (101 kg) at 6'1'' (1.85 m),,
5267,Oscar Herrera,,,,,Oscar,,,
5473,Bobby Dempsey,"Finderne, New Jersey (United States of America)",23rd February 1984 (age 38),23rd July 2005 (16 years ago),,Bobby Dempsey,,282 lbs. (128 kg),
1025,Derrick Neikirk,"Phoenix, Arizona (United States of America)",5th September 1974 (age 47),2000,,Derrick Neikirk,245 lbs. (111 kg) at 6'4'' (1.93 m),,
6951,unknown,,,10th October 1999 (22 years ago),,Diablo Santiago,225 lbs. (102 kg) at 6'2'' (1.88 m),,
8495,Carlos René Guajardo,"Monterrey, Nuevo León (Mexico)",30th June 1987 (age 34),2008,,René Guajardo Jr.,190 lbs. (86 kg) at 5'10'' (1.78 m),,
9838,unknown,"Liverpool, Merseyside, England (United Kingdom)",1985,,,Simon Valour,230 lbs. (104 kg) at 5'10'' (1.78 m),,
13678,Darrill Schoonover,"El Paso, Texas (United States of America)",18th June 1985 (age 36),12th January 2008 (14 years ago),,Darrill Schoonover,260 lbs. (118 kg) at 6'2'' (1.88 m),,
15244,Richard John Hatton,"Stockport, Greater Manchester, England (United Kingdom)",6th October 1978 (age 43),9th November 2009 (12 years ago),,Ricky Hatton,,,5'6'' (1.68 m)
29576,Sabatino Piscitelli,"Boca Raton, Florida (United States of America)",24th August 1983 (age 38),4th April 2015 (6 years ago),,Tino Sabbatelli,221 lbs. (100 kg) at 6'3'' (1.91 m),,
34417,Noah Nelms,"Olive Branch, Mississippi (United States of America)",30th July 1997 (age 24),,,Marko Stunt,,,5'2'' (1.57 m)
18583,Garett Bischoff,,20th April 1984 (age 37),7th November 2010 (11 years ago),,Garett Bischoff,,,
1912,Eric Alexander Pérez,Carolina (Puerto Rico),18th December 1979 (age 42),2000,,Escobar,246 lbs. (112 kg) at 6'3'' (1.91 m),,
723,Georg Welles,"Oakland, California (United States of America)",30th October 1947 (age 74),1972,,Georg Wells,265 lbs. (120 kg) at 6'1'' (1.85 m),,
1131,Kenny Stasiowski,"Anchorage, Alaska (United States of America)",18th June 1970 (age 51),21st August 1995 (26 years ago),,Kenny Kaos,235 lbs. (107 kg) at 6'0'' (1.83 m),,
2559,James McCreadie Brown,"Holytown, North Lanarkshire, Scotland (United Kingdom)",23rd February 1987 (age 35),??th July 2003,,James Wallace,215 lbs. (98 kg) at 6'0'' (1.83 m),,
687,Brian Brower,"Los Angeles, California (United States of America)",29th March 1982 (age 39),8th October 1999 (22 years ago),,Dixie,190 lbs. (86 kg) at 5'6'' (1.68 m),,
1547,Tony N. Roy,"Nashua, New Hampshire (United States of America)",4th April 1969 (age 52),1988,,Antoine Roy,245 lbs. (111 kg) at 6'0'' (1.83 m),,
13387,Rolles Gracie Jr.,"Río de Janeiro, Río de Janeiro (Brazil)",14th July 1978 (age 43),20th September 2007 (14 years ago),,Rolles Gracie,240 lbs. (109 kg) at 6'4'' (1.93 m),,
29272,Michael Rallis,"Edina, Minnesota (United States of America)",11th October 1989 (age 32),18th December 2014 (7 years ago),,Madcap Moss,245 lbs. (111 kg) at 6'3'' (1.91 m),,
727,Stanley Cooper Frazier,"Pascagoula, Mississippi (United States of America)",16th August 1937,1960,1st July 1992,Uncle Elmer,450 lbs. (204 kg) at 6'10'' (2.08 m),,
1232,Rafael Núñez Juan,"Ciudad de México, Ciudad de México (Mexico)",11th November 1966 (age 55),30th August 1985 (36 years ago),,Scorpio Jr.,216 lbs. (98 kg) at 5'9'' (1.75 m),,
898,Edgar Luna Pozos,"Ciudad de México, Ciudad de México (Mexico)",22nd April 1970 (age 51),,,Mr. Electro,209 lbs. (95 kg) at 6'2'' (1.88 m),,
4351,unknown,"East Lansing, Michigan (United States of America)",,2nd October 2004 (17 years ago),,Shane Hagadorn,205 lbs. (93 kg) at 5'11'' (1.80 m),,
6774,Moíses Neftalí Delgado Vargas,"Guadalajara, Jalisco (Mexico)",28th November 1982 (age 39),17th June 2007 (14 years ago),,Höruz,198 lbs. (90 kg) at 5'10'' (1.78 m),,
239,John Williams,"Baltimore, Maryland (United States of America)",1st June 1970 (age 51),10th August 1990 (31 years ago),,Ian Rotten,296 lbs. (134 kg) at 5'11'' (1.80 m),,
1012,Steven Lyle Doll,"Dallas, Texas (United States of America)",9th December 1960,??th May 1985,22nd March 2009,Steve Doll,240 lbs. (109 kg) at 6'0'' (1.83 m),,
2735,Lanny N. Kean,United States of America,19th September 1960,,13th January 2009,Moondog Cujo,,,
5020,Yukihide Matsuno,"Fukushima, Fukushima (Japan)",18th April 1961 (age 60),1st October 2001 (20 years ago),,Gorgeous Matsuno,165 lbs. (75 kg) at 5'11'' (1.80 m),,
5165,unknown,"Huejotzingo, Puebla (Mexico)",27th June 1969 (age 52),1999,,Mije,71 lbs. (32 kg) at 3'7'' (1.09 m),,
8060,David Lauridsen,"Randers, Midtjylland (Denmark)",,30th November 2007 (14 years ago),,Big D,220 lbs. (100 kg) at 6'2'' (1.88 m),,
9170,Robert Ross Jr.,,15th January 1959 (age 63),10th August 1986 (35 years ago),,Ranger Ross,225 lbs. (102 kg) at 6'0'' (1.83 m),,
9394,Gary Goodridge,Trinidad and Tobago,17th January 1966 (age 56),16th February 1996 (26 years ago),,Gary Goodridge,240 lbs. (109 kg) at 6'3'' (1.91 m),,
418,Zachary Gowen,"Livonia, Michigan (United States of America)",30th March 1983 (age 38),16th March 2002 (19 years ago),,Zach Gowen,169 lbs. (77 kg) at 5'11'' (1.80 m),,
158,Harold Hoag,"Detroit, Michigan (United States of America)",13th November 1967 (age 54),1990,,MI Smooth,315 lbs. (143 kg) at 6'2'' (1.88 m),,
2872,Dirk Hadameck,"Weinheim, Baden-Württemberg (Germany)",20th January 1978 (age 44),,,Dircor,300 lbs. (136 kg) at 5'9'' (1.75 m),,
2915,Norma Martínez,"San Cristóbal Ecatepec de Morelos, Estado de México (Mexico)",23rd April 1978 (age 43),,,La Comandante ,198 lbs. (90 kg) at 5'9'' (1.75 m),,
4127,Karen Jarrett,"Pittsburgh, Pennsylvania (United States of America)",12th October 1972 (age 49),2nd August 2007 (14 years ago),,Karen Jarrett ,,,5'10'' (1.78 m)
1719,Phil Friedman,"New York City, New York (United States of America)",,,,James Bronson,270 lbs. (122 kg) at 6'3'' (1.91 m),,
1908,Ferrin Barr Jr.,"Salt Lake City, Utah (United States of America)",14th April 1959 (age 62),,,Jesse Barr,242 lbs. (110 kg) at 6'0'' (1.83 m),,
1089,Michel Lamarche,"Saint-LinLaurentides, Quebec (Canada)",9th February 1947,1969,5th January 2019,Alexis Smirnoff,255 lbs. (116 kg) at 6'3'' (1.91 m),,
1985,Russell Payne Jr.,"Massillon, Ohio (United States of America)",1976,1998,,BJ Payne,245 lbs. (111 kg) at 6'1'' (1.85 m),,
6709,Jayne Hansford,"Weymouth, Dorset, England (United Kingdom)",10th May 1962 (age 59),16th August 1977 (44 years ago),,Klondyke Kate ,293 lbs. (133 kg) at 5'4'' (1.63 m),,
189,Tom Marquez,,,1996,,Tom Marquez,240 lbs. (109 kg) at 5'9'' (1.75 m),,
2096,William Kevin Vaughn,"Arlington, Texas (United States of America)",1959,1984,,Lance Von Erich,265 lbs. (120 kg) at 6'2'' (1.88 m),,
2523,David Ramin,Germany,,,,Tyrant,210 lbs. (95 kg) at 5'10'' (1.78 m),,
2841,Mike Becherer,"Campbell River, British Columbia (Canada)",28th April 1983 (age 38),15th September 2001 (20 years ago),,Eddie Osbourne,233 lbs. (106 kg) at 5'11'' (1.80 m),,
5552,unknown,"New York City, New York (United States of America)",,,,Grim Reefer,170 lbs. (77 kg) at 5'9'' (1.75 m),,
5774,unknown,"Birmingham, West Midlands, England (United Kingdom)",1987,,21st May 2008,Tommy White,218 lbs. (99 kg) at 6'2'' (1.88 m),,
6318,Amy Zidian,"Orlando, Florida (United States of America)",??th October 1985,2006,,Amy Zidian,,,5'9'' (1.75 m)
6825,Poul Roest,"Randers, Midtjylland (Denmark)",4th June 1972 (age 49),,,Mr. PPV,,,6'2'' (1.88 m)
7900,unknown,"Beverly Hills, California (United States of America)",21st November 1980 (age 41),2001,,Miss Holly Wood ,,,5'1'' (1.55 m)
8229,Richard Phillips,"Daytona Beach, Florida (United States of America)",7th January 1983,,22nd August 2020,Gerome Phillips,350 lbs. (159 kg) at 6'3'' (1.91 m),,
9233,Mike Whitehead,"Medford, Oregon (United States of America)",29th June 1981 (age 40),10th March 2001 (21 years ago),,Mike Whitehead,260 lbs. (118 kg) at 6'1'' (1.85 m),,
231,Ron Harris,"Nashville, Tennessee (United States of America)",23rd October 1961 (age 60),1987,,Ron Harris,280 lbs. (127 kg) at 6'5'' (1.96 m),,
10924,David Daniel Otunga,"Chicago, Illinois (United States of America)",7th April 1980 (age 41),20th March 2009 (12 years ago),,David Otunga,250 lbs. (113 kg) at 6'1'' (1.85 m),,
186,Lou D'Angeli,"Scarsdale, New York (United States of America)",,1995,,Lou E. Dangerously,200 lbs. (91 kg) at 5'7'' (1.70 m),,
12369,Brian Bary Jossie,Texas (United States of America),4th July 1977 (age 44),??th January 2008,,A.W.,220 lbs. (100 kg) at 6'2'' (1.88 m),,
3672,Xóchitl Leyva Sánchez,"Monterrey, Nuevo León (Mexico)",20th February 1973 (age 49),18th July 1993 (28 years ago),,Tiffany ,150 lbs. (68 kg) at 5'7'' (1.70 m),,
697,David Lugogo Sammartino,United States of America,26th September 1960 (age 61),1980,,David Sammartino,245 lbs. (111 kg) at 5'8'' (1.73 m),,
2307,Dylan Mark Postl,"Oshkosh, Wisconsin (United States of America)",29th May 1986 (age 35),2003,,Swoggle,115 lbs. (52 kg) at 4'4'' (1.32 m),,
1770,Mario González Lozano,"Torreón, Coahuila de Zaragoza (Mexico)",18th April 1969 (age 52),15th June 1988 (33 years ago),,Pimpinela Escarlata,189 lbs. (86 kg) at 5'9'' (1.75 m),,
18081,Christian Bruns,"Bocholt, Nordrhein-Westfalen (Germany)",16th December 1979 (age 42),,,Christian Bruns,,,
1809,unknown,Mexico,28th October 1971 (age 50),,,Axxel,189 lbs. (86 kg) at 5'9'' (1.75 m),,
712,Jesús Toral López,"Torreón, Coahuila de Zaragoza (Mexico)",7th January 1969 (age 53),??th January 1984,,Black Warrior,198 lbs. (90 kg) at 5'11'' (1.80 m),,
878,James Michael Rocha,"Chicago, Illinois (United States of America)",4th May 1970 (age 51),??th October 1991,,Jim Steele,275 lbs. (125 kg) at 6'4'' (1.93 m),,
2824,Mario Gurrola,"Monterrey, Nuevo León (Mexico)",31st January 1976 (age 46),26th July 1993 (28 years ago),,Hator,,187 lbs. (85 kg),
177,Donna Adamo,"New York City, New York (United States of America)",12th November 1970 (age 51),1998,,Elektra ,117 lbs. (53 kg) at 5'7'' (1.70 m),,
1952,Carlos Omar Cotto Cruz,Caguas (Puerto Rico),13th February 1980 (age 42),2000,,Chicano,220 lbs. (100 kg) at 6'0'' (1.83 m),,
2613,Niles Young,"Philadelphia, Pennsylvania (United States of America)",7th May 1982 (age 39),8th March 2003 (19 years ago),,Niles Young,203 lbs. (92 kg) at 6'0'' (1.83 m),,
7495,unknown,"Washington, District of Columbia (United States of America)",,,,Low Rider,175 lbs. (79 kg) at 5'8'' (1.73 m),,
17525,Brian McGhee,"New York City, New York (United States of America)",3rd February 1984 (age 38),2006,,Donovan Terrell,251 lbs. (114 kg) at 6'6'' (1.98 m),,
1113,Sean Dunster,"New York City, New York (United States of America)",,,,Massive Damage,255 lbs. (116 kg) at 6'0'' (1.83 m),,
1341,José de Jesús Pantoja Flores,"La Barca, Jalisco (Mexico)",28th April 1958 (age 63),??th September 1980,,Mogur,202 lbs. (92 kg) at 5'9'' (1.75 m),,
1647,Benjamin Bassarab,"Calgary, Alberta (Canada)",3rd March 1960 (age 62),1983,,Ben Bassarab,211 lbs. (96 kg) at 5'10'' (1.78 m),,
2377,unknown,"Anderson, South Carolina (United States of America)",,1984,,Basher,,,
3328,Michael Imburgia,,,,,Tower of Doom,,,
3774,unknown,"Birmingham, West Midlands, England (United Kingdom)",24th July 1985 (age 36),2000,,Jack Storm,232 lbs. (105 kg) at 6'0'' (1.83 m),,
4077,André Jodoin,"Calgary, Alberta (Canada)",23rd January 1959,,29th September 2014,Bill Jodoin,,,
4346,unknown,Guadeloupe,,,,Bobby Gaetano,230 lbs. (104 kg) at 6'0'' (1.83 m),,
5762,unknown,"Birmingham, West Midlands, England (United Kingdom)",6th November 1978 (age 43),1992,,Carnage,248 lbs. (112 kg) at 5'9'' (1.75 m),,
6515,Khalil Gaspard,United States of America,,,,Fabiano Rolento,220 lbs. (100 kg) at 6'0'' (1.83 m),,
8732,Peter R. Miller,"Rochester, New York (United States of America)",2nd September 1961 (age 60),??th August 1980,,Mongolian Mauler,319 lbs. (145 kg) at 6'4'' (1.93 m),,
10105,Julio Barrera,,1967,1987,,Jumbo Baretta,,375 lbs. (170 kg),
11043,Juan Gabriel Zentella Damián,"Villahermosa, Tabasco (Mexico)",9th January 1976,1993,2nd June 2021,Pasión Kristal,,,
15033,unknown,United Kingdom,,,,Jimmy Crash,,,
15862,Charles Daniel Bennett,"Ocala, Florida (United States of America)",23rd November 1979 (age 42),1st September 1999 (22 years ago),,Charles Bennett,155 lbs. (70 kg) at 5'5'' (1.65 m),,
30200,Joshua Bredl,"Denver, Colorado (United States of America)",28th January 1991 (age 31),25th August 2015 (6 years ago),,Bronson Mathews,290 lbs. (132 kg) at 6'7'' (2.01 m),,
29707,Savelina Fanene,"Sydney, New South Wales (Australia)",29th May 1984 (age 37),7th May 2015 (6 years ago),,Lina Fanene ,272 lbs. (123 kg) at 6'0'' (1.83 m),,
730,Felipe Estrada,"Frontera, Tabasco (Mexico)",19th June 1952 (age 69),1972,,El Canek,242 lbs. (110 kg) at 6'0'' (1.83 m),,
33909,David Allen Meltzer,"New York City, New York (United States of America)",24th October 1959 (age 62),,,Dave Meltzer,,,
1760,Michael P. Shaw,"Marquette, Michigan (United States of America)",9th May 1957,14th August 1980 (41 years ago),11th September 2010,Mike Shaw,360 lbs. (163 kg) at 6'1'' (1.85 m),,
273,Jesús Manuel Ortiz Partida,"Tijuana, Baja California (Mexico)",22nd May 1971 (age 50),3rd April 1987 (34 years ago),,Halloween,207 lbs. (94 kg) at 5'9'' (1.75 m),,
151,Alan Funk,"Alliance, Ohio (United States of America)",,??th September 1998,,Chi Chi,220 lbs. (100 kg) at 5'11'' (1.80 m),,
192,Ken Rinehurst,"Atlantic City, New Jersey (United States of America)",,1984,,Jack Victory,320 lbs. (145 kg) at 6'3'' (1.91 m),,
636,Darrell W. Anthony,"Knoxville, Tennessee (United States of America)",12th April 1960 (age 61),??th October 1980,,Dirty White Boy,211 lbs. (96 kg) at 5'9'' (1.75 m),,
220,Dennis Knight,"Orlando, Florida (United States of America)",26th December 1968 (age 53),1988,,Mideon,288 lbs. (131 kg) at 6'3'' (1.91 m),,
207,Jimmy Jaafil,"Los Angeles, California (United States of America)",19th July 1973 (age 48),??th December 1995,,Homeless Jimmy,205 lbs. (93 kg) at 5'10'' (1.78 m),,
2478,unknown,"Berlin, Berlin (Germany)",26th October 1981 (age 40),2001,,Jaxx,264 lbs. (120 kg) at 6'6'' (1.98 m),,
4279,unknown,Mexico,30th June 1977 (age 44),,,Metalika ,,,5'4'' (1.63 m)
6248,unknown,"Perth, Western Australia (Australia)",,1996,,Ashley Hudson,,,
13582,Andrew Inch,"Glenrothes, Fife, Scotland (United Kingdom)",5th September 1988 (age 33),,,Andy Wild,,,
24401,Steve Brauer,"Gera, Thüringen (Germany)",10th September 1984 (age 37),,,Big Steve,287 lbs. (130 kg) at 6'5'' (1.96 m),,
461,Richard C. Williams,"Marietta, Georgia (United States of America)",16th October 1965,1990,23rd February 1999,The Renegade,255 lbs. (116 kg) at 5'10'' (1.78 m),,
