,Real Name,Weight and Height,Birthplace,Date of Birth,Debut,wrestler_name,Date of Death,Weight,Height
1709,John Tolos,,"Hamilton, Ontario (Canada)",5th April 1933,1952,John Tolos,28th May 2009,,
3354,unknown,115 lbs. (52 kg) at 5'2'' (1.57 m),Saitama (Japan),14th May 1974 (age 47),16th June 2004 (17 years ago),Cherry ,,,
14987,Mert Kaloglu,197 lbs. (89 kg) at 6'1'' (1.85 m),"Berlin, Berlin (Germany)",28th August 1991 (age 30),19th April 2008 (13 years ago),Cem Kaplan,,,
523,Dolgorsuren Serjbudee,243 lbs. (110 kg) at 6'0'' (1.83 m),Mongolia,1st December 1976 (age 45),10th August 2001 (20 years ago),Blue Wolf,,,
1065,Mark Romero,249 lbs. (113 kg) at 6'0'' (1.83 m),"Amarillo, Texas (United States of America)",21st June 1963 (age 58),1981,Mark Youngblood,,,
1301,Gerardo Hernández Estrada,191 lbs. (87 kg) at 5'10'' (1.78 m),"Monclova, Coahuila de Zaragoza (Mexico)",10th January 1958 (age 64),1978,Jerry Estrada,,,
2220,Yoshinori Ota,191 lbs. (87 kg) at 5'8'' (1.73 m),"Kofu, Yamanashi (Japan)",12th April 1982 (age 39),24th December 2005 (16 years ago),Ippei Ota,,,
2287,unknown,235 lbs. (107 kg) at 5'8'' (1.73 m),"San Antonio, Texas (United States of America)",9th March ???,1982,Rudy Boy González,,,
3814,unknown,,Mexico,29th March 1986 (age 35),??th November 2001,El Espanto Jr.,,,
4434,Eric Matlock,203 lbs. (92 kg) at 6'0'' (1.83 m),"Santa Cruz, California (United States of America)",,??th December 1997,Rudy Switchblade,,,
5586,Robert Berzins,209 lbs. (95 kg) at 5'8'' (1.73 m),"Stoke-on-Trent, Staffordshire, England (United Kingdom)",21st July 1982 (age 39),1999,Robbie Dynamite,,,
5746,unknown,154 lbs. (70 kg) at 5'7'' (1.70 m),"Shrewsbury, Shropshire, England (United Kingdom)",,2002,Tommy Gunn,,,
8080,Duane Paul Ludwig,170 lbs. (77 kg) at 5'10'' (1.78 m),"Denver, Colorado (United States of America)",4th August 1978 (age 43),5th February 2000 (22 years ago),Duane Ludwig,,,
9872,unknown,,Mexico,,,Mascarita Sagrada,,,3'11'' (1.19 m)
9958,Mike Vito Massenzio,185 lbs. (84 kg) at 6'2'' (1.88 m),"Teaneck, New Jersey (United States of America)",1st November 1982 (age 39),2nd April 2005 (16 years ago),Mike Massenzio,,,
10592,Aaron Isaac Rosa,205 lbs. (93 kg) at 6'4'' (1.93 m),"Del Rio, Texas (United States of America)",28th May 1983 (age 38),5th November 2005 (16 years ago),Aaron Rosa,,,
11770,Kimo Leopoldo,235 lbs. (107 kg) at 6'3'' (1.91 m),"München, Bayern (Germany)",5th January 1968 (age 54),9th September 1994 (27 years ago),Kimo Leopoldo,,,
12304,Marie Gavillet,121 lbs. (55 kg) at 5'5'' (1.65 m),Switzerland,6th July 1986 (age 35),14th February 2008 (14 years ago),Amy Cooper ,,,
12804,unknown,187 lbs. (85 kg) at 5'5'' (1.65 m),"Guadalajara, Jalisco (Mexico)",25th June 1980 (age 41),8th November 2000 (21 years ago),Relámpago Azul,,,
13107,Lavar F. Johnson,255 lbs. (116 kg) at 6'4'' (1.93 m),"Madera, California (United States of America)",11th June 1977 (age 44),16th January 2004 (18 years ago),Lavar Johnson,,,
14656,Igor Pokrajac,205 lbs. (93 kg) at 6'0'' (1.83 m),Zagreb (Croatia),2nd January 1979 (age 43),9th February 2003 (19 years ago),Igor Pokrajac,,,
15400,unknown,,United Kingdom,9th February ???,,MK McKinnan,,,
16206,Rudy Hill,,,,,The Rude Boy,,,
16935,Billy Gram,180 lbs. (82 kg) at 6'4'' (1.93 m),"Cleveland, Ohio (United States of America)",16th February 1960 (age 62),2007,Billy Gram,,,
17196,Pascal Krauss,170 lbs. (77 kg) at 6'1'' (1.85 m),"Breisach, Baden-Württemberg (Germany)",19th April 1987 (age 34),27th January 2008 (14 years ago),Pascal Krauss,,,
22374,Koray Besli,167 lbs. (76 kg) at 5'8'' (1.73 m),"Wien, Wien (Austria)",12th October 1993 (age 28),1st October 2011 (10 years ago),Koray,,,
22554,unknown,389 lbs. (176 kg) at 5'7'' (1.70 m),United States of America,,,Kongo,,,
22662,Jared Papazian,125 lbs. (57 kg) at 5'8'' (1.73 m),"Los Angeles, California (United States of America)",1st February 1988 (age 34),6th June 2008 (13 years ago),Jared Papazian,,,
23006,unknown,,United Kingdom,9th May 1985 (age 36),,LA Austin,,,
31031,Jason Melrose,209 lbs. (95 kg) at 5'11'' (1.80 m),,,??th September 2014,Primate,,,
302,Barry Horowitz,221 lbs. (100 kg) at 6'0'' (1.83 m),"St. Petersburg, Florida (United States of America)",24th March 1960 (age 61),1979,Barry Horowitz,,,
73,Michael Bucci,214 lbs. (97 kg) at 5'10'' (1.78 m),"Toms River, New Jersey (United States of America)",5th June 1972 (age 49),??th January 1991,Simon Dean,,,
613,Noah Schiavone,,"Craigsville, Virginia (United States of America)",7th November 1957 (age 64),1986,Tony Schiavone,,,
1127,Emmanuel Fernández,250 lbs. (113 kg) at 5'10'' (1.78 m),"El Paso, Texas (United States of America)",,1979,Manny Fernández,,,
1254,Nicholas Patrick Hamilton,220 lbs. (100 kg) at 6'2'' (1.88 m),"Lakeland, Florida (United States of America)",9th November 1959 (age 62),1979,Nick Patrick,,,
1008,Hiromichi Fuyuki,240 lbs. (109 kg) at 6'0'' (1.83 m),"Tokyo, Tokyo (Japan)",11th May 1960,4th May 1980 (41 years ago),Kodo Fuyuki,19th March 2003,,
1659,James Grady Johnson,,"Little Rock, Arkansas (United States of America)",5th February 1940,1961,Luke Graham,23rd June 2006,,
2740,Darren O'Byrne,215 lbs. (98 kg) at 6'2'' (1.88 m),Ireland,,9th September 2004 (17 years ago),Mad Man Manson,,,
2842,Hideo Takayama,231 lbs. (105 kg) at 6'1'' (1.85 m),"Osaka, Osaka (Japan)",19th October 1969,20th January 1993 (29 years ago),Bad Boy Hido,17th October 2021,,
15589,unknown,,"Ciudad de México, Ciudad de México (Mexico)",9th November ???,,Robin,,,
453,Sione Havea Vailahi,295 lbs. (134 kg) at 6'5'' (1.96 m),Nuku'alofa (Tonga),6th September 1958 (age 63),1981,The Barbarian,,,
1673,Oleg Aleksandrovich Prudius,302 lbs. (137 kg) at 6'6'' (1.98 m),Kiew (Ukraine),27th April 1979 (age 42),7th April 2006 (15 years ago),Vladimir Kozlov,,,
311,Christopher Pailles,446 lbs. (202 kg) at 6'4'' (1.93 m),"Atlantic City, New Jersey (United States of America)",7th November 1957,1981,King Kong Bundy,4th March 2019,,
182,Carlene Denise Moore-Begnaud,149 lbs. (68 kg) at 5'4'' (1.63 m),"New Orleans, Louisiana (United States of America)",27th August 1972 (age 49),1998,Jazz ,,,
827,John Jairo Bedoya Jr.,215 lbs. (98 kg) at 5'9'' (1.75 m),"New York City, New York (United States of America)",28th December 1977,1997,Xavier,16th August 2020,,
1137,Anthony White,261 lbs. (118 kg) at 6'3'' (1.91 m),"Roanoke, Virginia (United States of America)",23rd April 1954 (age 67),1972,Tony Atlas,,,
804,Terry Szopinski,323 lbs. (147 kg) at 6'5'' (1.96 m),"Pompano Beach, Florida (United States of America)",28th March 1962 (age 59),1986,The Warlord,,,
26684,Seini Draughn,218 lbs. (99 kg) at 5'11'' (1.80 m),Germany,27th November 1982 (age 39),2011,Lei-D Tapa ,,,
1404,Timothy Deane Sylvia,310 lbs. (141 kg) at 6'8'' (2.03 m),"Ellsworth, Maine (United States of America)",5th March 1976 (age 46),19th January 2001 (21 years ago),Tim Sylvia,,,
28993,Levi Rolla Cooper,320 lbs. (145 kg) at 6'2'' (1.88 m),"Clackamas, Oregon (United States of America)",24th July 1990 (age 31),24th January 2015 (7 years ago),Tucker,,,
992,Kentaro Shiga,198 lbs. (90 kg) at 6'2'' (1.88 m),"Shirosato, Ibaraki (Japan)",6th December 1974 (age 47),21st February 1994 (28 years ago),Kentaro Shiga,,,
1086,Angel Orsini,155 lbs. (70 kg) at 5'6'' (1.68 m),"Fort Lauderdale, Florida (United States of America)",26th August 1969 (age 52),1996,Riptide ,,,
2071,Gadowar Singh Sahota,225 lbs. (102 kg) at 5'10'' (1.78 m),Punjab (India),8th December 1954 (age 67),,Gama Singh,,,
2453,Tom Jussen,157 lbs. (71 kg) at 5'7'' (1.70 m),"Voerendaal, Limburg (Netherlands)",1979,,Mot Van Kunder,,,
2931,Dean Robert Peters,220 lbs. (100 kg) at 5'10'' (1.78 m),"Robbinsdale, Minnesota (United States of America)",22nd August 1958,1984,Brady Boone,16th December 1998,,
3229,Ross Lindsay Hart,,"Calgary, Alberta (Canada)",3rd January 1960 (age 62),,Ross Hart,,,
5547,Mark Pantalone,225 lbs. (102 kg) at 5'11'' (1.80 m),"Deptford, New Jersey (United States of America)",10th May 1972 (age 49),,WHACKS,,,
8068,Alessio Sakara,185 lbs. (84 kg) at 6'0'' (1.83 m),"Roma, Lazio (Italy)",2nd September 1981 (age 40),21st June 2002 (19 years ago),Alessio Sakara,,,
1903,Gary K. Mize,240 lbs. (109 kg) at 6'1'' (1.85 m),"Houston, Texas (United States of America)",28th April 1961,,Billy Joe Travis,22nd November 2002,,
2367,unknown,,"Minneapolis, Minnesota (United States of America)",,,Eddie Sharkey,,,
2799,unknown,,"Heddesheim, Baden-Württemberg (Germany)",,,Toby Nathland,,,
2940,Roberto Rubio,262 lbs. (119 kg) at 6'3'' (1.91 m),Bayamón (Puerto Rico),,2000,Sexy B,,,
3810,unknown,150 lbs. (68 kg) at 5'4'' (1.63 m),Japan,8th November 1978 (age 43),26th January 2003 (19 years ago),Bullfight Sora ,,,
3965,Frank H. McKenzie,280 lbs. (127 kg) at 6'9'' (2.06 m),"Edmonds, Washington (United States of America)",21st July 1930,1950,Tex McKenzie,31st May 2001,,
4532,Jerry Arotski,242 lbs. (110 kg) at 6'1'' (1.85 m),United States of America,1963,,Jerry Oske,??th December 1995,,
5329,Francisco Alonso Lutteroth,,"Guadalajara, Jalisco (Mexico)",19th September 1952,,Paco Alonso,6th July 2019,,
6602,unknown,256 lbs. (116 kg) at 5'10'' (1.78 m),"Duncan, British Columbia (Canada)",20th February 1975 (age 47),28th September 1999 (22 years ago),Marty Sugar,,,
7543,Wilson Gouveia,185 lbs. (84 kg) at 6'1'' (1.85 m),"Fortaleza, Ceará (Brazil)",3rd October 1978 (age 43),17th November 2001 (20 years ago),Wilson Gouveia,,,
7597,unknown,201 lbs. (91 kg) at 5'11'' (1.80 m),"London, Greater London, England (United Kingdom)",19th February 1987 (age 35),2001,Tony Sefton,,,
7780,Timothy Wallace Credeur II.,185 lbs. (84 kg) at 6'3'' (1.91 m),"Lafayette, Louisiana (United States of America)",9th July 1977 (age 44),24th March 2001 (20 years ago),Tim Credeur,,,
8838,Luca Rusconi,172 lbs. (78 kg) at 5'9'' (1.75 m),"Losone, Tessin (Switzerland)",12th May 1983 (age 38),2008,Belthazar,,,
8992,Brad Lavale Blackburn Jr.,170 lbs. (77 kg) at 5'10'' (1.78 m),"Los Angeles, California (United States of America)",25th May 1977 (age 44),15th August 2001 (20 years ago),Brad Blackburn,,,
10455,unknown,,"Pittsburgh, Pennsylvania (United States of America)",30th October 1940,1962,Johnny DeFazio,26th February 2021,,
12803,Luis Francisco Villareal Becerra,,"Guadalajara, Jalisco (Mexico)",1976,1995,El Egipcio,5th October 2014,,
13318,unknown,,"Memphis, Tennessee (United States of America)",,,Dustin Starr,,,
15454,Jeanne Basone,122 lbs. (55 kg) at 5'7'' (1.70 m),"Glendale, California (United States of America)",19th May 1969 (age 52),5th December 1985 (36 years ago),Jeanne Basone,,,
16209,Anthony Perosh,205 lbs. (93 kg) at 6'3'' (1.91 m),"Sydney, New South Wales (Australia)",10th May 1972 (age 49),29th November 2003 (18 years ago),Anthony Perosh,,,
16458,Charles Brenneman,170 lbs. (77 kg) at 5'10'' (1.78 m),"Hollidaysburg, Pennsylvania (United States of America)",9th February 1981 (age 41),28th July 2007 (14 years ago),Charlie Brenneman,,,
21569,Dustin Pague,135 lbs. (61 kg) at 5'9'' (1.75 m),"Harrisburg, Pennsylvania (United States of America)",5th August 1987 (age 34),11th October 2008 (13 years ago),Dustin Pague,,,
21691,Jannik Hammes,150 lbs. (68 kg) at 5'7'' (1.70 m),"Mülheim an der Ruhr, Nordrhein-Westfalen (Germany)",13th June 1993 (age 28),5th September 2009 (12 years ago),Jason Hendrix,,,
22697,unknown,205 lbs. (93 kg) at 5'8'' (1.73 m),New York (United States of America),,??th August 2007,Jonny Mangue,,,
23221,John Brumbaugh,,"Blythewood, South Carolina (United States of America)",26th October 1987 (age 34),6th July 2008 (13 years ago),John Skyler,,,
23937,Cristiano Marcello,155 lbs. (70 kg) at 5'9'' (1.75 m),"Río de Janeiro, Río de Janeiro (Brazil)",3rd December 1977 (age 44),25th June 1997 (24 years ago),Cristiano Marcello,,,
24259,unknown,,United States of America,,,Brian Gewirtz,,,
1336,Aaron Rodríguez,231 lbs. (105 kg) at 5'11'' (1.80 m),"San Luis Potosí, San Luis Potosí (Mexico)",15th July 1942 (age 79),??th June 1965,Mil Máscaras,,,
1483,Samuel Larry Anoa'i Fatu,300 lbs. (136 kg) at 6'0'' (1.83 m),"San Francisco, California (United States of America)",1st September 1966 (age 55),1983,Tama,,,
121,Mark Jerrold Henry,399 lbs. (181 kg) at 6'4'' (1.93 m),"Austin, Texas (United States of America)",12th June 1971 (age 50),20th September 1996 (25 years ago),Mark Henry,,,
14599,Jon Andersen Reel,310 lbs. (141 kg) at 6'0'' (1.83 m),"Novato, California (United States of America)",8th January 1972 (age 50),,Strong Man,,,
2913,Marco Saldivar,176 lbs. (80 kg) at 5'8'' (1.73 m),"Ciudad de México, Ciudad de México (Mexico)",1st May 1978 (age 43),1998,Molotov,,,
14595,Karlee Leilani Pérez,115 lbs. (52 kg) at 5'3'' (1.60 m),"Tampa, Florida (United States of America)",19th April 1986 (age 35),2009,Candy Girl ,,,
512,Jorge Moraza,215 lbs. (98 kg) at 5'9'' (1.75 m),"Miami, Florida (United States of America)",1976,1999,Jorge Estrada,,,
920,Frederick Seawright,227 lbs. (103 kg) at 6'1'' (1.85 m),"Winter Haven, Florida (United States of America)",28th March 1958,??th March 1982,Brickhouse Brown,29th July 2018,,
3877,Ross Watson,189 lbs. (86 kg) at 5'11'' (1.80 m),"Glasgow, Glasgow, Scotland (United Kingdom)",22nd August 1984 (age 37),2001,Kid Fite,,,
4837,Pedro Jiménez,,"Chicago, Illinois (United States of America)",4th June 1985 (age 36),,CorVus,,,5'7'' (1.70 m)
26401,Jacob Southwick,285 lbs. (129 kg) at 6'8'' (2.03 m),"Toledo, Ohio (United States of America)",2nd April 1990 (age 31),16th October 2010 (11 years ago),Madman Fulton,,,
1443,Pierre Clemont,240 lbs. (109 kg) at 6'0'' (1.83 m),"Montréal, Quebec (Canada)",19th January 1941,1958,Pat Patterson,2nd December 2020,,
2903,unknown,159 lbs. (72 kg) at 5'5'' (1.65 m),"Ciudad de México, Ciudad de México (Mexico)",21st August 1986 (age 35),2001,Eléctrico,,,
552,Junji Hirata,254 lbs. (115 kg) at 6'0'' (1.83 m),"Hiratsuka, Kanagawa (Japan)",20th December 1956 (age 65),26th August 1978 (43 years ago),Super Strong Machine,,,
1872,unknown,231 lbs. (105 kg) at 6'1'' (1.85 m),"Machida, Tokyo (Japan)",1st October 1982 (age 39),3rd May 2003 (18 years ago),KAZMA SAKAMOTO,,,
432,Ryan Sakoda,240 lbs. (109 kg) at 6'0'' (1.83 m),"Tokyo, Tokyo (Japan)",31st December 1972,1998,Ryan Sakoda,2nd September 2021,,
618,Rieko Amano,121 lbs. (55 kg) at 5'2'' (1.57 m),"Shimizu, Shizuoka (Japan)",16th March 1976 (age 45),4th December 1994 (27 years ago),Carlos Amano ,,,
1070,John Costa,216 lbs. (98 kg) at 5'7'' (1.70 m),"Vancouver, British Columbia (Canada)",20th November 1983 (age 38),6th September 1998 (23 years ago),Quiet Storm,,,
2897,unknown,194 lbs. (88 kg) at 5'9'' (1.75 m),"Ciudad de México, Ciudad de México (Mexico)",13th June ???,16th September ???,Ultramán Jr.,,,
5556,unknown,209 lbs. (95 kg) at 6'2'' (1.88 m),"Liverpool, Merseyside, England (United Kingdom)",5th May 1970 (age 51),??th June 1990,Frankie Sloan,,,
8133,Caol Uno,145 lbs. (66 kg) at 5'7'' (1.70 m),"Yokosuka, Kanagawa (Japan)",8th May 1975 (age 46),4th October 1996 (25 years ago),Caol Uno,,,
12373,Samuel Gradwell,,"Blackpool, Lancashire, England (United Kingdom)",,20th February 2009 (13 years ago),Sam Gradwell,,,
18889,unknown,,"Ciudad de México, Ciudad de México (Mexico)",28th December 1990 (age 31),2008,Lolita ,,,
721,Christopher Todd Mordetzky,257 lbs. (117 kg) at 6'4'' (1.93 m),"Santa Monica, California (United States of America)",8th January 1983 (age 39),15th August 2002 (19 years ago),Chris Masters,,,
476,Wayne Bloom,244 lbs. (111 kg) at 6'1'' (1.85 m),"Minneapolis, Minnesota (United States of America)",22nd March 1958 (age 63),1986,Wayne Bloom,,,
7044,Joseph Ruby,249 lbs. (113 kg) at 6'0'' (1.83 m),"Franklinville, New Jersey (United States of America)",8th August 1987 (age 34),29th July 2006 (15 years ago),Joe Gacy,,,
3010,Diana Joyce Hart,,"Calgary, Alberta (Canada)",8th October 1963 (age 58),,Diana Hart ,,,
36025,Jordan Omogbehin,400 lbs. (181 kg) at 7'3'' (2.21 m),Lagos (Nigeria),16th May 1994 (age 27),18th July 2019 (2 years ago),Omos,,,
735,Keith A. Franke,310 lbs. (141 kg) at 5'11'' (1.80 m),"Buffalo, New York (United States of America)",15th September 1954,1974,Adrian Adonis,4th July 1988,,
16366,Fale Simitaitoko,308 lbs. (140 kg) at 6'4'' (1.93 m),Tonga,8th January 1982 (age 40),4th April 2010 (11 years ago),Bad Luck Fale,,,
3007,Lacey Adkisson,,"Dallas, Texas (United States of America)",17th July 1985 (age 36),2007,Lacey Von Erich ,,,
111,Shoichi Funaki,180 lbs. (82 kg) at 5'7'' (1.70 m),"Tokyo, Tokyo (Japan)",24th August 1968 (age 53),1990,FUNAKI,,,
14093,William Arturo Muñoz González,216 lbs. (98 kg) at 6'0'' (1.83 m),"Tala, Jalisco (Mexico)",29th September 1988 (age 33),29th July 2007 (14 years ago),Rush,,,
168,Jerry Tuite,340 lbs. (154 kg) at 6'10'' (2.08 m),"Ocean Grove, New Jersey (United States of America)",27th December 1966,1994,Jerry Tuite,6th December 2003,,
3545,Tim Suxdorf,236 lbs. (107 kg) at 6'7'' (2.01 m),"Kiel, Schleswig-Holstein (Germany)",29th April 1986 (age 35),16th June 2007 (14 years ago),Tim Suxdorf,,,
5841,Shaaheen Hosseinpour,235 lbs. (107 kg) at 6'1'' (1.85 m),"London, Greater London, England (United Kingdom)",27th February 1985 (age 37),,Sha Samuels,,,
844,Gregory Allan Gagne,220 lbs. (100 kg) at 6'1'' (1.85 m),"Robbinsdale, Minnesota (United States of America)",27th July 1948 (age 73),15th April 1973 (48 years ago),Greg Gagne,,,
4551,Koutane Nakazawa,198 lbs. (90 kg) at 5'9'' (1.75 m),"Kawasaki, Kanagawa (Japan)",8th October 1975 (age 46),??th September 2005,MT Nakazawa,,,
2490,Tetsuo Sekigawa,286 lbs. (130 kg) at 6'0'' (1.83 m),"Isesaki, Gunma (Japan)",25th February 1951,20th March 1972 (49 years ago),Mr. Pogo,23rd June 2017,,
2852,Greg Burridge,230 lbs. (104 kg) at 6'1'' (1.85 m),"London, Greater London, England (United Kingdom)",25th September 1981 (age 40),,Greg Burridge,,,
3866,Harvinder Sihra,144 lbs. (65 kg) at 5'9'' (1.75 m),"Burnaby, British Columbia (Canada)",2nd November 1987 (age 34),??th July 2006,Samir Singh,,,
16320,James Lee Dowell,,"Blackpool, Lancashire, England (United Kingdom)",4th March 1993 (age 29),,James Drake,,,
1084,unknown,315 lbs. (143 kg) at 6'4'' (1.93 m),"Waharoa, Waikato (New Zealand)",,1995,Mana,,,
1901,Ray Samalonis,205 lbs. (93 kg) at 5'10'' (1.78 m),"Palm Beach, Florida (United States of America)",31st January 1968 (age 54),1988,Ray Odyssey,,,
4072,Garfield Portz,245 lbs. (111 kg) at 6'1'' (1.85 m),"Bradford, West Yorkshire, England (United Kingdom)",1957,1979,Scott McGhee,,,
15407,Andreas Kraniotakes,245 lbs. (111 kg) at 6'3'' (1.91 m),"München, Bayern (Germany)",10th December 1981 (age 40),16th July 2005 (16 years ago),Andreas Kraniotakes,,,
15974,Colby Corino,117 lbs. (53 kg) at 5'7'' (1.70 m),"Philadelphia, Pennsylvania (United States of America)",28th August 1996 (age 25),,Colby Corino,,,
1264,Mark Marcos,190 lbs. (86 kg) at 5'7'' (1.70 m),"Rochester, New York (United States of America)",16th October 1981 (age 40),??th January 2000,Dave Marcos,,,
1294,unknown,195 lbs. (88 kg) at 6'2'' (1.88 m),"New Orleans, Louisiana (United States of America)",,2001,Sedrick Strong,,,
1791,Rolando Fuentes Romero,150 lbs. (68 kg) at 5'2'' (1.57 m),"Veracruz, Veracruz de Ignacio de la Llave (Mexico)",5th May 1982 (age 39),7th April 1996 (25 years ago),Mini Histeria,,,
1810,Julio Domingo Estrada Cáceres,250 lbs. (113 kg) at 5'11'' (1.80 m),Humacao (Puerto Rico),1969,1984,Rico Suave,,,
3273,unknown,165 lbs. (75 kg) at 5'7'' (1.70 m),Texas (United States of America),12th March 1981 (age 40),1999,El Hombre sin Miedo,,,
3334,Reginald Walt,235 lbs. (107 kg) at 6'3'' (1.91 m),"Memphis, Tennessee (United States of America)",,1989,Reggie B. Fine,,,
3604,unknown,290 lbs. (132 kg) at 6'2'' (1.88 m),United Kingdom,1975,,Thunder,,,
3610,unknown,165 lbs. (75 kg) at 5'8'' (1.73 m),"Richmond, Virginia (United States of America)",17th February 1972 (age 50),??th October 1994,Jack Doan,,,
3637,unknown,267 lbs. (121 kg) at 6'4'' (1.93 m),"Portland, Michigan (United States of America)",20th August 1963 (age 58),1981,Bob Cook,,,
4370,unknown,257 lbs. (117 kg) at 6'1'' (1.85 m),"Versailles, Missouri (United States of America)",,,Wade Chism,,,
4425,David Younkins,311 lbs. (141 kg) at 6'5'' (1.96 m),"Pittsburgh, Pennsylvania (United States of America)",30th March 1962 (age 59),1990,T. Von Rantula,,,
4441,John Lusk,245 lbs. (111 kg) at 6'1'' (1.85 m),"Chino, California (United States of America)",27th November 1957 (age 64),,Johnny Mantell,,,
4487,Sergio Pacheco Hernández,220 lbs. (100 kg) at 5'9'' (1.75 m),Mexico,28th November 1975 (age 46),5th December 1992 (29 years ago),Sepulturero,,,
4618,Juan José Barrón Medina,198 lbs. (90 kg) at 5'7'' (1.70 m),"Teocuitatlán de Corona, Jalisco (Mexico)",22nd September 1952 (age 69),2nd October 1966 (55 years ago),Gran Cochisse,,,
4648,unknown,143 lbs. (65 kg) at 5'8'' (1.73 m),"Helsinki, Uusimaa (Finland)",,??th August 2004,Kisu ,,,
5608,Dale Richards,130 lbs. (59 kg) at 5'3'' (1.60 m),"Redcar, North Yorkshire, England (United Kingdom)",1st June 1989 (age 32),,Kid Richie,,,
6135,Dean Ayass,,"Brighton and Hove, East Sussex, England (United Kingdom)",8th May 1976 (age 45),,Dean Ayass,,,5'9'' (1.75 m)
7154,Crystal Carmichael,125 lbs. (57 kg) at 5'8'' (1.73 m),"Chicago, Illinois (United States of America)",3rd October 1981 (age 40),,Crystal White ,,,
7230,Romon Eduardo Rodríguez,250 lbs. (113 kg) at 6'1'' (1.85 m),"Santiago de León de Caracas, Distrito Capital (Venezuela)",7th April 1932,,Ciclón Negro,20th February 2013,,
7243,unknown,290 lbs. (132 kg) at 6'3'' (1.91 m),"Matane, Quebec (Canada)",21st July 1942 (age 79),,Neil Guay,,,
7897,James McGee,130 lbs. (59 kg) at 5'9'' (1.75 m),Quebec (Canada),,,Twiggy,,,
8075,Joseph Daniel Doerksen,185 lbs. (84 kg) at 6'0'' (1.83 m),"New Bothwell, Manitoba (Canada)",9th October 1977 (age 44),6th February 1999 (23 years ago),Joe Doerksen,,,
8082,Jonathan Goulet,170 lbs. (77 kg) at 6'1'' (1.85 m),"Victoriaville, Quebec (Canada)",13th July 1979 (age 42),16th December 2001 (20 years ago),Jonathan Goulet,,,
8433,unknown,240 lbs. (109 kg) at 5'9'' (1.75 m),New York (United States of America),21st April 1987 (age 34),21st May 2005 (16 years ago),Kaide Lothbrok,,,
9049,unknown,,"Manchester, Greater Manchester, England (United Kingdom)",1988,,Kristov Eganski,,179 lbs. (81 kg),
9488,Evangelista Santos,170 lbs. (77 kg) at 5'10'' (1.78 m),"Rondonópolis, Mato Grosso (Brazil)",12th December 1977 (age 44),20th November 1997 (24 years ago),Evangelista Santos,,,
10086,unknown,364 lbs. (165 kg) at 6'0'' (1.83 m),"Goderich, Ontario (Canada)",,11th September 2004 (17 years ago),Jeff Black,,,
10402,Scott Reed,200 lbs. (91 kg) at 5'7'' (1.70 m),"Manchester, New Hampshire (United States of America)",6th November 1985 (age 36),14th March 2003 (18 years ago),Scott Reed,,,
10415,Trevor Prangley,205 lbs. (93 kg) at 6'1'' (1.85 m),Cape Town (South Africa),24th August 1972 (age 49),18th January 2001 (21 years ago),Trevor Prangley,,,
11735,unknown,200 lbs. (91 kg) at 5'10'' (1.78 m),"Montréal, Quebec (Canada)",,4th July 1999 (22 years ago),Kid Rock,,,
12638,Jessica Aguilar,115 lbs. (52 kg) at 5'3'' (1.60 m),Mexico,8th May 1982 (age 39),18th February 2006 (16 years ago),Jessica Aguilar ,,,
12655,André Galvão,170 lbs. (77 kg) at 5'9'' (1.75 m),"São Paulo, São Paulo (Brazil)",29th September 1982 (age 39),30th August 2008 (13 years ago),André Galvão,,,
12756,Yoshitomi Mishima,145 lbs. (66 kg) at 5'7'' (1.70 m),Hyogo (Japan),19th April 1972 (age 49),17th January 1998 (24 years ago),Dokonjonosuke*Mishima,,,
12863,Kazunori Yokota,155 lbs. (70 kg) at 5'8'' (1.73 m),"Funabashi, Chiba (Japan)",3rd April 1978 (age 43),19th September 2004 (17 years ago),Kazunori Yokota,,,
12877,unknown,177 lbs. (80 kg) at 6'1'' (1.85 m),"Ciudad de México, Ciudad de México (Mexico)",1982,16th March 2005 (16 years ago),Canelo Casas,,,
13204,Igor Yaroslavovich Vovchanchyn,205 lbs. (93 kg) at 5'8'' (1.73 m),Solotschiw (Ukraine),6th August 1973 (age 48),25th September 1995 (26 years ago),Igor Vovchanchyn,,,
15586,Travis Fulton,230 lbs. (104 kg) at 6'0'' (1.83 m),"Waterloo, Iowa (United States of America)",29th May 1977,26th July 1996 (25 years ago),Travis Fulton,10th July 2021,,
15771,Michael Kevin Guymon,170 lbs. (77 kg) at 6'0'' (1.83 m),"Newport Beach, California (United States of America)",17th September 1974 (age 47),3rd May 1999 (22 years ago),Michael Guymon,,,
15774,Bryan Caraway,135 lbs. (61 kg) at 5'8'' (1.73 m),"Yakima, Washington (United States of America)",21st October 1982 (age 39),16th September 2005 (16 years ago),Bryan Caraway,,,
18031,Tie Quan Zhang,155 lbs. (70 kg) at 5'8'' (1.73 m),Nèi Menggu (China),25th July 1985 (age 36),6th November 2005 (16 years ago),Tie Quan Zhang,,,
23772,unknown,,United Kingdom,,,Orion Adams,,,5'9'' (1.75 m)
23823,Isaac Vallie-Flagg,155 lbs. (70 kg) at 5'8'' (1.73 m),"Ann Arbor, Michigan (United States of America)",8th April 1978 (age 43),3rd August 2003 (18 years ago),Isaac Vallie-Flagg,,,
24187,Timothy LaMonte-Whistler,196 lbs. (89 kg) at 5'11'' (1.80 m),"Livingston, New Jersey (United States of America)",16th June 1982 (age 39),7th April 2012 (9 years ago),Tim Zbyszko,,,
24238,unknown,,"Indianapolis, Indiana (United States of America)",,,Jason Lee,,,
24641,unknown,234 lbs. (106 kg) at 6'0'' (1.83 m),"San Nicolás de los Garza, Nuevo León (Mexico)",18th September 1990 (age 31),2009,Herodes Jr.,,,
35795,unknown,237 lbs. (108 kg) at 6'3'' (1.91 m),"New Haven, Connecticut (United States of America)",8th November 1992 (age 29),2015,Richard Holliday,,,
37000,unknown,,Colorado (United States of America),,,Abadon ,,,
447,Michael Sean Coulthard,176 lbs. (80 kg) at 5'7'' (1.70 m),"Syracuse, New York (United States of America)",8th December 1968 (age 53),1997,Michael Cole,,,
885,James Manley,237 lbs. (108 kg) at 5'11'' (1.80 m),"Orlando, Florida (United States of America)",4th January 1958 (age 64),1984,Jim Powers,,,
683,Bobby Edward Duncum Jr.,296 lbs. (134 kg) at 6'6'' (1.98 m),"Amarillo, Texas (United States of America)",26th August 1965,??th September 1992,Bobby Duncum Jr.,24th January 2000,,
